{
  "schema": "provenant-log-reduction.v1",
  "command": "git status",
  "source_sha256": "bbbbbbbbbbbbbbbbbbbbbbbbbbbbbbbbbbbbbbbbbbbbbbbbbbbbbbbbbbbbbbbb",
  "exit_status": 0,
  "source_bytes": 14,
  "reduced_bytes": 14,
  "quoted_lines": [],
  "dropped_spans": [],
  "reduced": false,
  "text": "working tree clean"
}
